<?xml version="1.0" encoding="iso-8859-1"?>
<!DOCTYPE schedule PUBLIC "http://www.dcccd.edu/SXML/2006/" "http://www.dcccd.edu/SXML/2006/schedule.dtd">
<schedule date-created="7/11/2007" time-created="1:46 PM">
  <term name="2007FA" sortkey="1" year="2007" start-date="8/27/2007" end-date="12/13/2007">
    <location name="200" sortkey="BHC">
      <grouping type="rubric" name="ACCT">
        <course course="ACCT-2301" rubric="ACCT" number="2301" title="Prin Acct I" long-title="Prin Acct I" credit-hours="3.00">
          <class title="Prin Acct I" sortkey="ACCT-2301-2250" synonym="453167" rubric="ACCT" number="2301" section="2250" course-section="ACCT-2301-2250" location-code="200" location="BHC" start-date="09/08/07" end-date="12/08/07" weeks="14" credit-type="CR" status="A" capacity="20" schedule-type="W" weekend="true" full-term="false" start-month="9" at-night="false" minimester="false" flex-term="false" self-paced="false" dual-credit="false" jail="false" off-campus="false" out-of-county="false" out-of-system="false" distance-learning="false" online="false" fast-track="false">
            <meeting days="S" method="LEC" building="BHM" room="M133" start-time="9:00 AM" end-time="12:05 PM">
              <faculty first-name="Patricia" middle-name="Ann" last-name="Bassett" class-load="20.00" />
            </meeting>
          </class>
          <class title="Prin Acct I" sortkey="ACCT-2301-2420" synonym="453171" rubric="ACCT" number="2301" section="2420" course-section="ACCT-2301-2420" location-code="200" location="BHC" start-date="09/04/07" end-date="12/11/07" weeks="15" credit-type="CR" status="A" capacity="25" schedule-type="DL" distance-learning="true" full-term="false" start-month="9" at-night="false" weekend="false" minimester="false" flex-term="false" self-paced="false" dual-credit="false" jail="false" off-campus="false" out-of-county="false" out-of-system="false" online="false" fast-track="false">
            <description>ACCT 2301 requires access to the Internet, e-mail, Microsoft Word and
Excel. The orientation is online and must be completed by the third
class day. Final exam must be taken at an approved monitored testing
site. Enter http://ecampus.dcccd.edu and log in using your seven-digit
student I.D. number as both the user name and password. Contact
claricemccoy@dcccd.edu for information.</description>
            <alt-description>ACCT 2301 requires access to the Internet, e-mail, Microsoft Word and
Excel. The orientation is online and must be completed by the third
class day. Final exam must be taken at an approved monitored testing
site. Enter http://ecampus.dcccd.edu and log in using your seven-digit
student I.D. number as both the user name and password. Contact
claricemccoy@dcccd.edu for information.</alt-description>
            <meeting days="MTWRFSU" method="INET" building="CET" room="INET" start-time="" end-time="">
              <faculty first-name="Clarice" last-name="McCoy" email="cmccoy@dcccd.edu" class-load="20.00" />
            </meeting>
            <xlisting title="Prin Acct I" sortkey="ACCT-2301-9468" synonym="460799" rubric="ACCT" number="2301" section="9468" course-section="ACCT-2301-9468" credit-type="CR" />
          </class>
          <class title="Prin Acct I" sortkey="ACCT-2301-2421" synonym="439972" rubric="ACCT" number="2301" section="2421" course-section="ACCT-2301-2421" location-code="200" location="BHC" start-date="09/04/07" end-date="12/11/07" weeks="15" credit-type="CR" status="A" capacity="25" schedule-type="DL" distance-learning="true" full-term="false" start-month="9" at-night="false" weekend="false" minimester="false" flex-term="false" self-paced="false" dual-credit="false" jail="false" off-campus="false" out-of-county="false" out-of-system="false" online="false" fast-track="false">
            <description>ACCT 2301 requires access to the Internet, e-mail, Microsoft Word
and Excel. The orientation is online and must be completed by the third
class day. Final exam must be taken at an approved monitored
testing site. Enter http://ecampus.dcccd.edu and log in using your
seven-digit student I.D. number as both the user name and password.
Contact claricemccoy@dcccd.edu for information.</description>
            <alt-description>ACCT 2301 requires access to the Internet, e-mail, Microsoft Word
and Excel. The orientation is online and must be completed by the third
class day. Final exam must be taken at an approved monitored
testing site. Enter http://ecampus.dcccd.edu and log in using your
seven-digit student I.D. number as both the user name and password.
Contact claricemccoy@dcccd.edu for information.</alt-description>
            <meeting days="MTWRFSU" method="INET" building="CET" room="INET" start-time="" end-time="">
              <faculty first-name="Clarice" last-name="McCoy" email="cmccoy@dcccd.edu" class-load="20.00" />
            </meeting>
            <xlisting title="Prin Acct I" sortkey="ACCT-2301-9467" synonym="460801" rubric="ACCT" number="2301" section="9467" course-section="ACCT-2301-9467" credit-type="CR" />
          </class>
          <class title="Prin Acct I" sortkey="ACCT-2301-2423" synonym="453173" rubric="ACCT" number="2301" section="2423" course-section="ACCT-2301-2423" location-code="200" location="BHC" start-date="10/01/07" end-date="11/05/07" weeks="6" credit-type="CR" status="A" capacity="37" schedule-type="DL" distance-learning="true" full-term="false" start-month="10" at-night="false" weekend="false" minimester="false" flex-term="false" self-paced="false" dual-credit="false" jail="false" off-campus="false" out-of-county="false" out-of-system="false" online="false" fast-track="false">
            <description>ACCT 2301 requires access to the Internet, e-mail, Microsoft Word and
Excel. The orientation is online and must be completed by the third
class day. Final exam must be taken at an approved monitored testing
site. Enter http://ecampus.dcccd.edu and log in using your seven-digit
student I.D. number as both the user name and password. Contact
claricemccoy@dcccd.edu for information.</description>
            <alt-description>ACCT 2301 requires access to the Internet, e-mail, Microsoft Word and
Excel. The orientation is online and must be completed by the third
class day. Final exam must be taken at an approved monitored testing
site. Enter http://ecampus.dcccd.edu and log in using your seven-digit
student I.D. number as both the user name and password. Contact
claricemccoy@dcccd.edu for information.</alt-description>
            <meeting days="MTWRFSU" method="INET" building="CET" room="INET" start-time="" end-time="">
              <faculty first-name="Clarice" last-name="McCoy" email="cmccoy@dcccd.edu" class-load="20.00" />
            </meeting>
            <xlisting title="Prin Acct I" sortkey="ACCT-2301-9470" synonym="460807" rubric="ACCT" number="2301" section="9470" course-section="ACCT-2301-9470" credit-type="CR" />
          </class>
          <class title="Prin Acct I" sortkey="ACCT-2301-2424" synonym="453175" rubric="ACCT" number="2301" section="2424" course-section="ACCT-2301-2424" location-code="200" location="BHC" start-date="10/01/07" end-date="12/10/07" weeks="11" credit-type="CR" status="A" capacity="37" schedule-type="DL" distance-learning="true" full-term="false" start-month="10" at-night="false" weekend="false" minimester="false" flex-term="false" self-paced="false" dual-credit="false" jail="false" off-campus="false" out-of-county="false" out-of-system="false" online="false" fast-track="false">
            <description>ACCT 2301 requires access to the Internet, e-mail, Microsoft Word and
Excel. The orientation is online and must be completed by the third
class day. Final exam must be taken at an approved monitored testing
site. Enter http://ecampus.dcccd.edu and log in using your seven-digit
student I.D. number as both the user name and password. Contact
claricemccoy@dcccd.edu for information.</description>
            <alt-description>ACCT 2301 requires access to the Internet, e-mail, Microsoft Word and
Excel. The orientation is online and must be completed by the third
class day. Final exam must be taken at an approved monitored testing
site. Enter http://ecampus.dcccd.edu and log in using your seven-digit
student I.D. number as both the user name and password. Contact
claricemccoy@dcccd.edu for information.</alt-description>
            <meeting days="MTWRFSU" method="INET" building="CET" room="INET" start-time="" end-time="">
              <faculty first-name="Clarice" last-name="McCoy" email="cmccoy@dcccd.edu" class-load="20.00" />
            </meeting>
            <xlisting title="Prin Acct I" sortkey="ACCT-2301-9471" synonym="460809" rubric="ACCT" number="2301" section="9471" course-section="ACCT-2301-9471" credit-type="CR" />
          </class>
          <class title="Prin Acct I" sortkey="ACCT-2301-2425" synonym="453183" rubric="ACCT" number="2301" section="2425" course-section="ACCT-2301-2425" location-code="200" location="BHC" start-date="10/24/07" end-date="12/11/07" weeks="8" credit-type="CR" status="A" capacity="37" schedule-type="DL" distance-learning="true" full-term="false" start-month="10" at-night="false" weekend="false" minimester="false" flex-term="false" self-paced="false" dual-credit="false" jail="false" off-campus="false" out-of-county="false" out-of-system="false" online="false" fast-track="false">
            <description>ACCT 2301 requires access to the Internet, e-mail, Microsoft Word and
Excel. The orientation is online and must be completed by the third
class day. Final exam must be taken at an approved monitored testing
site. Enter http://ecampus.dcccd.edu and log in using your seven-digit
student I.D. number as both the user name and password. Contact
claricemccoy@dcccd.edu for information.</description>